,Unnamed: 0,Emotion,Sentence
2750,830,Disgust,"con gái ăn_nói kiểu gì vậy trời , mình rất ghét con gái nói_tục chữi thề"
2751,125,Disgust,"suốt ngày sân_si , chia bè_phái bốc phốt nhau mà khi nghe chia lớp theo tn - xh lại bảo buồn"
2752,1102,Enjoyment,"thú_vui mới , thay_vì chọc chó thì ghẹo ngỗng cho nó dí = ) ) ) )"
2753,1249,Sadness,có_lẽ vậy là tốt nhất
2754,865,Sadness,tận_cùng của nỗi đau 
2755,184,Disgust,chị dâu thì vãi rồi
2756,758,Enjoyment,nhờ mất bạn nên mình mới biết 
2757,323,Other,con quan rồi lại thành quan . chỉ dân mãi là kẻ bần_hàn
2758,389,Fear,kinh_khủng
2759,671,Enjoyment,cưng quá mà
2760,1511,Anger,xiên chết cụ nó đi
2761,102,Other,khi nào nha anh sẽ lắp hả per
2762,1202,Enjoyment,cưng vãi ấy
2763,57,Enjoyment,lớp chúng_mình rất rất vui anh_em ta chan_hoà tình thân = ) ) )
2764,4,Fear,tinh_trùng của người ngoài hành_tinh thật đáng sợ 
2765,1343,Sadness,tội em vợ thế : (
2766,1899,Surprise,ơ hoá_ra là em à : ( ( lâu quá không gặp
2767,234,Other,ko nên nhé các cụ .... hãy cho họ 1 cơ_hội ... hãy nhìn sự_việc từ nhiều khía_cạnh khác nhau
2768,1091,Sadness,bắt ve cho nó điiii . trông khổ quá
2769,1337,Disgust,hic . nhiều khi thấy bả ngu thiệc chứ kp đùa 
2770,1491,Enjoyment,rất chuẩn hãy sống làm người cơn luôn_luôn co hiểu thảo với cha_mẹ của mình nhé moi người ơi
2771,919,Other,sao không ghé quán rồi nhờ người_nhà cầm nón qua cho : ) ) ) tự làm_khó mình vậy
2772,1720,Enjoyment,con xe thần_thánh . chạy hơn 50 năm chưa nát = ) ) )
2773,808,Other,có người_yêu thì vẫn ăn bánh_trung_thu nhé . bánh_trung_thu là thứ tồn_tại duy_nhất . có em hay không không quan_trọng
2774,611,Sadness,đã từng . hix
2775,1932,Enjoyment,chắc là năm lớp 4 5 gì đó : ) ) tao mua bánh_kẹo đem vô lớp bán_lẻ lại ... mỗi lần đem bán như_vậy chắc cũng kiếm được lãi 2 - 30k 
2776,1027,Disgust,có cái con cặc .. chúng_mày chỉ diễn thôi đúng không . dume chỉ diễn thôi .. : ' (
2777,983,Enjoyment,nháy_mắt cũng đáng yêu kkkk
2778,652,Other,nghĩ cũng tội mà thôi cũng kệ
2779,1482,Disgust,trẻ trâu chấp nó làm_gì
2780,194,Other,bắc_sơn lạng_sơn đang cháy khô rồi mưa cái gì chứ 
2781,210,Enjoyment,per chị ơi còn học được cả tiếng anh nữa luôn này : v hịn quá
2782,1912,Anger,"cổ_nhân có câu : thương cho roi , cho vọt - ghét cho ngọt cho bùi_. muốn con trở_thành người tốt , nhưng gv nghiêm_khắc thì lại phản_đối . thật không_thể hiểu nổi ."
2783,740,Enjoyment,biết nấu cơm bếp củi từ lớp 2 _ 3 gì đó
2784,1023,Sadness,dạ đây là chị_gái em nha không phải chồng đâu ạ người trong hình là em huhu ?
2785,1744,Enjoyment,giỏi thật chứ đùa . biểu_cảm gần như 90 % chuẩn mẹ rồi . thằng quay và edit cũng ghê luôn . nhảy cũng tốt ra phét chứ - . - ác thật
2786,121,Fear,không cẩn_thận phát là ngậm bả như_chơi
2787,1786,Disgust,có thịt bò nướng là ngon rồi bày_đặt_kiến đốt
2788,1004,Other,"không có sức hút thì tao vẫn cắt , mùa hè để tóc dài nóng thấy mẹ"
2789,1638,Disgust,bạn có phải óc chó không ? chắc bạn không trả_lời được đâu nhỉ . óc chó mà = ) ) )
2790,834,Disgust,"móng tay dài như_vậy thì làm gì để sống phục_vụ bản_thân cũng khó_khăn uổng_phí hết tuổi_trẻ một đời người để nuôi một bộ móng , thay vào đó làm việc gì có_ích cho bản_thân gia_đình và xã_hội , đời người ngắn_ngủi nên trân_trọng thời_gian quý_báu của mình"
2791,1939,Surprise,chỉ ăn 1 miếng thịt mà phải đốt chết thêm nhiều sinh_mạng bé_nhỏ nữa hả
2792,821,Other,có đứa nào nấu cơm rồi nấu luôn cái bếp như tao không
2793,171,Enjoyment,"đếu thể đỡ được "" tiền mừng , tiền mừng "" hahaha"
2794,1072,Disgust,hãm lol nhưng thật lòng chứ còn hơn cứ tỏ ra trưởng_thành mà bên trong thì như đồ bỏ đi
2795,717,Other,per nghe có_vẻ hợp_lí nhỉ ?
2796,1167,Other,ngoài_ra thì nó còn bị mang_tiếng là thả thính cả xã_hội nữa
2797,1764,Disgust,"từ nhỏ đến lớn chỉ nghe được câu mày béo thế , mày nên giảm cân đi chứ không ai nói rằng mày gầy lắm ăn nhiều lên "
2798,733,Sadness,cơ_mà tao bị thần_kinh thật
2799,59,Anger,kiện chết mẹ mấy con súc_vật đó đi
2800,591,Other,sắm về hỏi mấy thứ : v
2801,159,Disgust,cứ bảo ngon lắm với chả ngon vừa . không biết_nghĩ trước khi ăn à
2802,702,Other,con này là con lợn hay con gấu hay con ong vậy ? ? ? ?
2803,815,Other,tại mình thử hết rồi : ) ) nên cậu nói thế_thì mình bình_luận thôi : ) )
2804,39,Enjoyment,thề cứ 1 lần trượt là tao cười to hơn 
2805,701,Disgust,mặt_nạ chứ không phải mặt lạ nhé . ngọng thế_mà cũng lấy được vợ ? ? ? ?
2806,842,Enjoyment,per nhờ mất bạn nên mình mới biết 
2807,1340,Enjoyment,thứ ba mẹ cho con và con nhận thấy đó là sự đức_hạnh tấm lòng cao_cả cam on ba_mẹ rất nhìu
2808,1651,Disgust,nhìn mặt thấy hãm buồi rồi .
2809,675,Enjoyment,hãy nên trân_trọng những người bạn như_vậy .
2810,1010,Other,nhớ bộ phim thằng gù nhà_thờ đức_bà không ?
2811,1591,Sadness,bây_giờ nhìn vào cứ kiện_tụng mà nãn : ( (
2812,1612,Surprise,thiết_kế tinh_tế quá
2813,1095,Sadness,tớ cũng muốn có mối tình như_vậy ? ?
2814,1858,Enjoyment,một bộ phim quá suất sắc
2815,481,Anger,suốt ngày bị chửi ? ?
2816,1909,Surprise,mình không hiểu tại_sao nó không bị phóng_điện chết nhỉ ?
2817,886,Sadness,vì tao hay bị chúng_nó chọc nên thấy buồn
2818,660,Enjoyment,một bình_luận của người trong cuộc . đọc xong thấy ấm lòng cho per !
2819,1875,Disgust,chó nhà tao mới đi lạc 3 hôm thôi mà quên mẹ hết chủ rồi : vậy
2820,51,Anger,"có hình_ảnh rõ_ràng kiện chúng_nó tội quấy_rối đi . mịe cái lũ khốn_kiếp , hay_ho lắm cái_trò dơ_bẩn 蠟蠟蠟"
2821,1854,Surprise,nhà nó giàu vãi
2822,944,Other,per quả_lừa con chó ngoài bờ_rào
2823,1609,Surprise,wow đỉnh quá
2824,454,Other,ước gì tao thất_tình cũng được giống như mày
2825,1639,Surprise,"cái kết thật bất_ngờ , không_thể đoán được vậy"
2826,1878,Enjoyment,per nhìn mặt cưng gê
2827,169,Other,là đứa quay video
2828,163,Other,cái lò xô ngày_xưa ma
2829,778,Other,một chuyến du_lịch vui_vẻ
2830,731,Enjoyment, hành_động nhỏ v thôi_thì cũng ấm lòng rồi ... nói thôi cũng vuii rồi ... 
2831,1393,Sadness,"chúng_ta những tháng_ngày sau đó vẫn gặp nhau , vẫn nói_chuyện nhưng không phải những cô_cậu của hồi c3 nữa . chúng_ta đều khác"
2832,708,Enjoyment,bé gái đáng yêuc quá : ) ) ) . dth nữa
2833,1943,Disgust,cho khỏi đá ở việt_nam . gì mà căng
2834,905,Disgust,hình_thức này .. là chúng_nó đang huỷ_hoại mầm_mống tương_lai của đất_nước đấy
2835,1275,Sadness,trông tội quá
2836,666,Other,"hai con ma đấu đầu , con mũ đen ăn toàn cứt nên đanh hơn ?"
2837,447,Other,"nó mừng kiểu nhảy vồ lên dơ đồ thôi , chứ dòng này gặp ai cũng mừng"
2838,590,Anger,per ghét ghê bây
2839,1391,Sadness,"học chán_phèo , chả có gì đáng nhớ"
2840,158,Anger,"tao cảnh_cáo , page mà đăng mấy video kiểu ngôn lù thế_này tao unlike , trả per trả cụ lầy , trả anh thai cho tao"
2841,1042,Other,chắc làm theo yêu_cầu
2842,212,Enjoyment,"coi 3 lần mà vẫn cười , phim hay nhân_vật dễ_thương"
2843,1596,Sadness,per sự thích thể_hiện của các bạn mà bóng_đá per tốn một món tiền không nhỏ ! 洛
2844,971,Disgust,"mất nhân_tính ( tiền không phải tất_cả , nhưng làm tất_cả vì tiền )"
2845,1521,Enjoyment,thớt là gu của tôi : ) ) ) yêu quá hiuhiu
2846,927,Sadness,muộn rồi : ) ) )
2847,922,Enjoyment,thề lun anh ấy rất kĩ_thuật lun á
2848,1749,Enjoyment,per có sub rồi nè . má coi đi coi lại vẫn mắc_cười . với đưa anh stk đi
2849,967,Enjoyment,bt mà tao vẫn lạng_lách ở đây suốt
2850,996,Enjoyment,chỉ mong có người đến cuối đời vẫn yêu mình như ngày đầu_tiên ❤
2851,1755,Enjoyment,anh thíck kiểu tra_tấn hằng ngày : ) ) )
2852,786,Other,tuổi_thơ với nó đấy
2853,1771,Surprise,vợ_chồng nhà này mặc quần_áo ngủ đôi à ? ?
2854,277,Enjoyment,buồn_cười nhất cái đoạn cã lũ bạn đồng_thanh * chó nó lấy * 
2855,424,Anger,"đúng rồi còn quay quay , lớ nga lớ_ngớ xuống trách người ta . có phải bãi xe tự_phát đâu mà người ta dám làm láo ."
2856,1055,Disgust,dăm_ba cái yêu_đương vớ_vẩn : ) )
2857,748,Other,ủa tao đang coi cái gì v 
2858,119,Other,tàn_nhang là xác_định nhá ? ? ? ? ? ?
2859,1796,Disgust,sao toàn gặp hãm không àh . gần nhất_là thằng âm_binh nhất
2860,1031,Other,phe áo vàng thích điều này
2861,534,Other,có_khi giờ tỉnh rồi đéo dám xuống nữa
2862,1235,Enjoyment,lại đến giờ giải_trí rồi mềnh ơiiii per = ) ) ) ) )
2863,823,Other,vừa xung_điện tim xong ra ngoài bác_sĩ lắc_đầu = ) ) cả nhà tao đưa bác_sĩ vô nằm kế tao
2864,1364,Disgust,thói ích_kỷ
2865,1579,Disgust,thứ học_sinh mất_dạy = ) )
2866,572,Anger,má tự_dưng bị đánh vào đầu : (
2867,1109,Enjoyment,mong ông_bà nhiều sức_khoẻ . đáng yêu thực_sự 
2868,1821,Disgust,nhìn gai vãi
2869,1597,Disgust,đọc thôi cũng mệt
2870,513,Sadness,có những ngày mọi thứ nó bỗng ập đến
2871,785,Disgust,per thề : ) ) ) cười cơ_mà tao nghĩ nó cũng đéo ổn tí nào đâu
2872,1207,Sadness,chỉ khổ các con thôi ! ! sao người ta lại có_thể mất nhân_tính như_vậy
2873,1010,Enjoyment,cute vậyyyyy
2874,645,Other,thế rồi cha lái_xe có giả tiền không các bác
2875,1362,Sadness,nàng ấy chả yêu ta gì cả
2876,469,Sadness,1 năm không biết_bao_nhiêu lần x - quang : (
2877,653,Fear,thôi xong tao rồi : ( (
2878,1411,Enjoyment,chỉ cần nhìn họ thì đã thấy tim đập mạnh rồi = ) ) )
2879,241,Disgust,phú_thọ tởm quá
2880,1620,Surprise,smart phone thành cục gạch là có thật luôn hả ? ?
2881,1455,Enjoyment,"3 idiots , bộ phim rất đáng xem"
2882,1441,Sadness,nói gì thì tụi bây cũng không tin đâu .. 
2883,295,Other,per nhà mình cũng có nè
2884,380,Other,bây_giờ lại chơi trò đánh tư_sản mại_bản như ngày_xưa đi nhể
2885,1297,Sadness,anh đánh mất thật rồi
2886,1748,Anger,đậu_xanh tao giỡn mặt với mày hả
2887,1130,Disgust,những cái đáng làm không làm những cái không đáng làm thì làm cho tới
2888,662,Sadness,hình_như sau boss bị chết ạ
2889,654,Other,xong tao đưa mày uống nha
2890,199,Enjoyment,may_mà không mua laptop này không thì ăn lìn lâu rồi : (
2891,1195,Sadness,nếu chịu_khó đặt vào hoàn_cảnh của nhau mà sống thì mọi chuyện đã đơn_giản hơn rồi .
2892,557,Anger,đéo đùa : ) )
2893,689,Other,nhìn hình_vẽ khẩu_trang lại tưởng 1 con mắt = ) ) ) ) ) ) ) )
2894,753,Enjoyment,có đứa nào đéo giật_mình như tao không : ) ) )
2895,135,Anger,"băng băng cái lol , chưa đóng vào mặt nhau là may rồi"
2896,720,Sadness,"ôi mệt quá , một ngày buồn_tẻ"
2897,2,Fear,bố đi đường mà sợ quá
2898,1431,Anger,bác_sĩ mất_dạy
2899,116,Fear,disss giật hết cả mình . : ) )
2900,1281,Sadness,có_lẽ vì_vậy nên moi thứ trở_nên thật khó_khăn lúc này : ( ( (
2901,16,Enjoyment,bà đã được sống 1 kiếp người hạnh_phúc . mấy_ai có được điều đó . ngưỡng_mộ tình_yêu ông dành cho bà .
2902,1315,Enjoyment,sau khi có vợ anh per đã có đồ giả gái xinh và tinh_tế hơn 
2903,851,Enjoyment,"per đi coi với tao , phim này hay nhất_định phải coi"
2904,432,Enjoyment,đứng trước mặt nó tụt quần ra auto hết giận
2905,1374,Enjoyment,haha đây là cổng chợ này ? ?
2906,1640,Enjoyment,giống y_con bạn tao : ) ) ) mặc_dù nó không phải gvien hay gì cả nhưng nó khá trẻ trâu
2907,665,Enjoyment,nói_chuyện yêuu thế đmaaaa ? ?
2908,1741,Enjoyment,dễ_thương ghê . thằng quay_phim cũng không phải dạng vừa ^ ^
2909,47,Other,yên_tâm đi ông trời không bất_công với ai đâu
2910,631,Sadness,ko biết crush bây_giờ có ở nhà không nữa 
2911,394,Enjoyment,là khi lạc giữa 1 biển người hôm khai_giảng nhưng vẫn nhìn thấy người đó rõ nhất
2912,452,Anger,đồ điên . quét đéo được thì lấy máy_hút_bụi hút mẹ hết đi . hét hét cái lol gì = ) ) )
2913,1073,Enjoyment,"hay ta , hay ta"
2914,1539,Sadness,anh ấy không thương tao
2915,1162,Other,mặc cái váy thì phải cạp lông lách chứ : ) ) )
2916,866,Sadness,nhìn lũ trẻ yêu nhau mà lòng già xao_xuyến
2917,570,Other,ai đã dùng nó bây_giờ phải 50 tuổi rồi
2918,1222,Enjoyment,"1 đoạn phim được trích ra tuy ngắn nhưng , chứa 1 thông_điệp rất có tầm quan_trọng"
2919,419,Enjoyment,quan_trọng là đỉnh ^ .
2920,1399,Enjoyment,đem người đó ra biển cho biển cuốn đi lun .. hihii
2921,608,Anger,"hàng_loạt các sai_phạm , vi_phạm diễn ra nhưng bộ giáo_dục chưa đưa ra được biện_pháp nào có hiệu_quả chấm_dứt các sự_việc tiếp_tục xảy ra"
2922,1550,Anger,"trách_nhiệm của con_mẹ giáo_viên chủ_nhiệm là lớn nhất luôn , đuổi con_mẹ nó việc đi"
2923,899,Enjoyment,đúng rồi con gái là vậy_mà kkk
2924,1551,Sadness,tan_tành rồi .
2925,603,Sadness,chẳng biết nói gì . xem video em cười suốt mà lòng tôi không thấy vui tẹo nào . thương em
2926,845,Anger,xử_tử hiệu_trưởng . nhà_nước phải làm thẳng_tay bọn chó
2927,1729,Disgust,người ta mất 6 tháng để học lái_xe nhưng lại mất cả đời để học văn_hoá đỗ xe 
2928,425,Other,ngày_xưa nghèo . có bếp dầu là mai rồi .
2929,475,Sadness,ba ́ o giâ ̣ tao ti ́ tao la ̀ mày hoa ̉ người loa ̣ n ngươ ̀ i dân . haizzz
2930,608,Other,hãy tôn_trọng quyền được mưu_cầu hạnh_phúc của mỗi cá_nhân con_người trên thế_giới này đi . đừng kì_thị họ ! tội_lỗi lắm 
2931,1358,Enjoyment,"má .. , ruồi bay qua táp chết_tươi : ) ) )"
2932,1577,Enjoyment,per cái gì mình không làm được chứ đánh cái lũ đéo phải người thì mình làm tốt kkk
2933,712,Other,per hèn_gì thấy ngày nào anh cũng đi tập 
2934,1903,Surprise,ẹc lông chân_mày mọc nhanh dữ = . =
2935,1038,Sadness,ngày_xưa cũng vui lắm mà giờ mỗi đứa 1 nơi rồi
2936,718,Enjoyment,per em cười mệt quá = ) ) ) )
2937,667,Disgust,móng tay gì mà nhìn vừa bẩn vừa ghê
2938,253,Fear,"tuổi_thơ của tao sợ nhất là con này , không làm gì mà nó cũng rược , suốt ngày thì kêu um_sùm"
2939,531,Anger,lần sau nhìn thấy hắt nước_tiểu vào người nó ngay
2940,1608,Enjoyment,bấy bề ơi . thật là đáng yêu
2941,649,Other,tuỳ người tuỳ loại
2942,535,Enjoyment,cư ́ như kiê ̉ u = ) ) ) ngươ ̀ i yêu
2943,512,Anger,"thằng ác_ôn , con_nhỏ nhờ tháo mạng_nhện thôi mà cũng không giúp , tao là móc gậy ra thọc .. à nhầm tháo mạng_nhện ra liền .."
2944,306,Fear,"hồi nhỏ đi học phải ngang qua nhà nuôi ngỗng nó dí chạy thấy bà luôn , ngày nào cũng phải cầm cái cây theo . thề luôn tới giờ tao vẫn còn sợ con này khiếp luôn "
2945,1168,Sadness,ăn cơm mốc có khả_năng bị ung_thư gan cao . hít
2946,426,Enjoyment,bác này nói hay
2947,1011,Other,mới sáng ra
2948,107,Fear,"tao có một nỗi sợ khác cũng khá giống con yêu_tinh này đó là con yêu nghiệt ngan đực : 3 con này thành tinh hung_ác vãi _ chưởng , đi ra vườn đéo làm gì nó , nó cũng rượt mình . đậu ! đó là tao kể ngày bé thôi = ) chứ lớn lên tao biết vơ cây củi theo để đi ra vườn rồi = ) )"
2949,343,Enjoyment,cười vãi ? ? ? ? ? ? ? ? mặt con_bé cũng hài ghê
2950,1039,Disgust,"quán này chắc không đông , đang ăn mà thấy có mà ói"
2951,995,Sadness,để nó vậy không thấy tội sao
2952,508,Enjoyment,boss dễ_thương hết_sức
2953,727,Other,nấu thì nấu được mà không biết có ăn được hay không thôi
2954,760,Disgust,"dume tao từ giờ sẽ bỏ thích cái page này huhu , nghiệp mà"
2955,1712,Disgust,đi xe cao mà ý_thức thấp quá !
2956,1185,Enjoyment,mình đã về đến nhà an_toàn hihi
2957,1768,Surprise,lông chân mọc nhanh thế : ) )
2958,66,Fear,quá nguy_hiểm .
2959,1642,Enjoyment,ơ tao cũng học ông này hướng_dẫn hay sao ấy : ) ) ) ) )
2960,592,Sadness,và người đó đang ở nơi đâu về với em đi . đợi người rồi người sẽ đến chứ ?
2961,1609,Disgust,bảo sao đi đâu ai cũng ghét = ) )
2962,305,Disgust,"đã gọi là "" mật "" mà nó lại công_khai cho mày xem àk"
2963,260,Enjoyment,hahaa ngọt vãiii : ) )
2964,35,Other,mơ chứ còn gì nữa 
2965,372,Enjoyment,per tìm được đối_tượng nào để cầu_hôn chưa : ) ) )
2966,1437,Sadness,dự là 30 mà 30 sợ già quá chả chó nào nó rước . năm nay đã 26 rồi mà vẫn chả ai thèm yêu 
2967,1323,Sadness,nhìn em mà thương roi nói_chuyện mắt
2968,1676,Enjoyment,em vợ tao đấy : ) )
2969,668,Enjoyment,"con_bé xinh nhờ , khốn_nạn là cái thằng edit video ý : ) ) )"
2970,1772,Surprise,1 lần chơi lớn xem thế_giới có trầm_trồ ? ?
2971,1083,Enjoyment,per phim này thấy trailer hấp_dẫn ghê 
2972,1379,Enjoyment,ngồi nhìn nó ngủ cũng thấy dth vler đừng nói cười 
2973,46,Fear,cái này ghê vãi mày sẽ hiểu cảm_giác khi nó lún xuống 
2974,295,Disgust,không thấy tên phim thì hỏi . ở đấy mà hội người mụ cái đéo gì . đã mất_công ghi tên phim thì ghi cho đàng_hoàng vào . bất lịch_sự vậy !
2975,539,Enjoyment,hèn dì mấy nay đi học thấy bạn của crush nhìn mình cười
2976,1941,Surprise,wow vừa vẽ đẹp lại còn biết sáng_tạo : ) )
2977,348,Other,cái này đi móc cống thốn lắm nè
2978,1125,Enjoyment,từ nay tôi quết định nuôi_dưỡng con chim tôi tới già . và tôi mong được unesco công_nhận kỳ_quan thứ 8 của thế_giới
2979,227,Other,mình chỉ quan_tâm cái quần bạn chồng mặc màu hường hình cô gái ? ? ? ?
2980,921,Disgust,loại gái già mất_dạy chách sao không dạy được con_cháu .
2981,287,Disgust,chộm chó đâu làm_ăn như céc lúc cần thì chả thấy đâu
2982,709,Enjoyment,thông_minh hơi muộn nhưng vẫn kịp thông_minh !
2983,427,Sadness,cay_đắng và mặn : (
2984,1700,Enjoyment,cóc nào tao không có thích thầm đứa nào để đứng lại ngắm cái chỗ ngồi nhể 
2985,558,Anger,nó sale còn 225k là được rồi : ) ) ) lời quá còn gì . mẹ mày per bình_luận chi để nó nhận ra chi v 
2986,745,Disgust,"loại này nó vậy , y_con chó nhà mình .. hjjjj"
2987,1801,Surprise,đỉnh vậy luôn hả
2988,1416,Sadness,chẳng_những hư xe mà_còn bị phạt nặng nữa
2989,211,Other,mẹ còn không trị được thì ai trị 
2990,998,Sadness,tớ có thấy con ngáo đấy nhưng không dám lại sờ huhu tt
2991,1043,Enjoyment,nhờ đó mà tôi cảm_thấy nhẹ_nhõm và trở_nên mạnh_mẽ
2992,745,Enjoyment,tao ấn_tượng anh đầm hường ghê 
2993,133,Other,đứa nào bắt_cóc nhỏ này thấy khổ vãi
2994,1166,Sadness,đồng cảnh_ngộ : (
2995,1488,Enjoyment,ngọt hơn cả người_yêu haaaaa
2996,1147,Disgust,thôi mấy bác bị dắt_mũi rồi . nghe đến đoạn au mobile là biết nó quảng_cáo game trá_hình rồi . như con cặc
2997,1912,Enjoyment,đọc nhiều chuyện cổ_tích vầy thấy yêu cuộc_sống hẳn : ) )
2998,1810,Disgust,bố mày lậy chúng_mày đấy
2999,1749,Surprise,mấy cái video của bọn này đóng hay vãi
3000,1003,Enjoyment,"ở nói_chuyện ngoài hộ không khì thị về giới_tính , họ cho được kết_hôn . chứ họ không kì_thị như ở việt_nam mình hai người kia họ thật dũng_cảm khi sống thật với giới_tính của mình"
3001,347,Other,bà chủ_tịch giả mang thai và cái kết
3002,1066,Disgust,phạt 5 triệu ... pháp_luật vn hay dữ
3003,824,Sadness,phải_chi có người để giận mình nhỉ : ( ( (
3004,987,Sadness,"per cần thêm những trái dâu xinh_xắn để ngăn_chặn sự u_ám này , huhu"
3005,501,Enjoyment,lúc nhỏ bà hàng_xóm của tao bị dí chạy tới mức bã phải nhảy xuống sông bã lội trốn mà tụi nó cũng nhảy theo với bã 藍
3006,1801,Disgust,tao cũng có ghệ và tao cũng dị_ứng mấy trường_hợp mắc mệt giống vậy
3007,689,Sadness,khổ_thân em ý .
3008,309,Enjoyment,không_những hạnh_phúc tao còn cứng nữa : ) )
3009,90,Anger,"chỉ có bọn nông_dân mới nghĩ ra mấy trò này , phải con_cháu nhà tao thì tao đến từng nhà 1 bắt từng thằng ăn cứt"
3010,1104,Disgust,kinh_dị vãi 
3011,93,Anger,phải là người_yêu tao thì sống_chết tao cũng vả hết
3012,812,Disgust,vậy nên phải lịch_sự và thổ con_mẹ nó lộ với cả đống người chúc_mừng mày thành trò_cười thiên_hạ
3013,641,Enjoyment,đkm lại diễn rồi pr cho game aumobile chứ gì tuổi lol qua mắt tao = ) )
3014,332,Other,"cà_phê vần luôn cả với sa tế , thế_là đủ vị đắng_cay"
3015,638,Sadness,chuẩn luôn : 3 độc vô_tình bắt_gặp thôi cơ_mà giờ tao bị ăn bơ rồi 
3016,359,Enjoyment,có ai luyện mới được như mình không dạ
3017,1895,Disgust,còn thằng súc_sinh này
3018,1913,Disgust,"lớp 1 tao đã bị nằm sấp lên bàn , bị đánh 20 - 30 cây vì tội viết chữ không có tiến_bộ mà có dám hó_hé gì đâu . còn học_sinh giờ sắp thành_hiệu trưởng hết rồi"
3019,1805,Fear,hết_hồn chim én
3020,1952,Surprise,thật ư 
3021,1302,Sadness,cô ấy không yêu tôi
3022,1319,Sadness,ừ công_nhận == không có tiền mua
3023,916,Disgust,"xã_hội giờ nguy_hiểm quá . có_khi cái con_mẹ kia mới là người có ý_định bắt_cóc trẻ_con ấy chứ , hoặc chỉ một câu trêu đùa quái_ác như_thế cũng đủ mệt"
3024,1007,Other,nó ăn_chay mà
3025,380,Enjoyment,trò_cười . : v
3026,543,Enjoyment,đáng yêu vậy
3027,1771,Disgust,người ta dùng con kiến bống . loại có chất axit có vị chua . chứ đéo ai dùng loại kiến_đen cứt_trâu này .
3028,1268,Anger,"gặp tao là đéo nói nhìu , lùi xe ra rồ ga tông thẳng vào : ) ) ) )"
3029,193,Other,phải_chi quán đầu_tư cái máy_hút_bụi thì đỡ cho anh ấy quá = ) ) )
3030,1155,Enjoyment,cũng dể thương đấy chứ
3031,1058,Other,thực_ra ngoài mày nó còn quan_tâm nhiều đứa nữa
3032,1775,Surprise,anh quay_phim giọng hơi cute nhỉ 
3033,937,Enjoyment,cảm_ơn bố !
3034,1856,Enjoyment,nhìn đã thật
3035,1922,Enjoyment,niềm vui của cđv việt_nam đây mà
3036,623,Enjoyment,tao thích vẽ . nhưng vẽ xấu từ đó chuyển hẳn sang mê chụp ảnh .
3037,1208,Sadness,tạm_biệt ông 
3038,912,Enjoyment,khoảnh_khắc nhận ra đồng_nghiệp mình is the best : ) ) nguyễn_ngọc thái hiền
3039,741,Enjoyment,tao cười tao ỉa = ) ) ) ) ) ) hâhhahhahahahaha
3040,449,Other,nên là có sắp chết tao cũng đéo kể cho ai nghe : ) ) )
3041,808,Sadness,tiền nhiều để làm gì ? để rồi lại chia_ly
3042,1143,Other,"và nếu có 1 người_yêu mà chơi với nhiều thằng con trai thì hãy cẩn_thận , mày có_thể bị cắm_sừng khi nào không hay"
3043,1446,Enjoyment,thường thôi . hồi nhỏ tao nấu kiểu này hoài . nấu lun cái bếp nhà chú
3044,565,Sadness,xỉu lên xỉu xuống : (
3045,887,Enjoyment,để anh dẫn em đi ăn nha : ) )
3046,1504,Sadness,tao đã khóc khi xem phim nay
3047,141,Other,cây như cổ_chân thì sao năng xuất . cại đủ tiền công không mà chia
3048,683,Other,per một thời của chậy em mình nè
3049,1060,Enjoyment,thiệt là dễ_thương quá đi mất . 
3050,972,Disgust,nhảy không lo nhảy còn quay quay
3051,1705,Enjoyment,giòi béo lắm : ) )
