,Unnamed: 0,Emotion,Sentence
3904,788,Other,t chỉ ngồi nhà và ngắm cảnh tắc đường thôi
3905,267,Other,mình có xài rồi nè hồi lúc đi làm xí nghiêp gọi là lò xô đổ dầu xài
3906,657,Sadness,không biết phải mình lúa không . chứ mỗi lần đi du_lịch trước khi trả phòng là mình phải dọn sạch_sẽ . cứ nghĩ nhận phòng sao thì trả phòng vậy . bị anh chồng la hoài là vậy
3907,813,Sadness,em đang ở đâu mà mấy năm rồi chưa thấy xuất_hiện : )
3908,415,Sadness,vì tao xấu và chúng_nó chỉ thích gái đẹp
3909,454,Anger,"chó chứ không phải người , rất mong pháp_luật anh_minh"
3910,850,Disgust,t xem phim này cứ thích bà ma nhập vào thôi chứ bình_thường yếu đúi nhạt tao không thích
3911,1199,Sadness,cay_đắng cuộc_đời  một_chút vị mặn của mồ_hôi_nước_mắt
3912,153,Fear,"theo mình thì không nên vì định_kiến xã_hội quá khắc_nghiệt , họ sẽ bị tổn_thương và nghĩ quẩn"
3913,836,Enjoyment,đáng yêuc vãi anh ơi
3914,1640,Surprise,tao tưởng tới đoạn per tuyên_bố hôn nụ hôn chia_tay chứ … ai_ngờ kết_quả lại khác bây
3915,1311,Enjoyment,per : ) ) chắc giống cảm_nhận của ông lái oto hôm_qua
3916,1543,Sadness,"ước gì mèo nhà mình cũng có_thể về nhà như_vậy , mất ẻm được 2 năm rồi : ( ( ("
3917,1716,Enjoyment,bà ngày_xưa đẹp quá ❤️
3918,1152,Disgust,chỉ có mấy thằng ấn ngáo ngơ vừa bẩn trông chẳng giá gì . đúng là lớp 1 trượt môn đạo_đức vì tội không ju jin vệ_sinh thân_thể
3919,404,Anger,cái quần gì vậy đmmmmm đang tủi_thân xem cái lol này nữa
3920,1409,Sadness,khổ người lao_động thôi
3921,1159,Sadness,thiếu hình ăn gà rán rồi
3922,1004,Sadness,boss hổng có 6 múi hả : ( buồn dị
3923,440,Sadness,phải tự cho mình đau_lòng nhất thì mới bỏ được
3924,559,Anger,"quay quay cái lồn , thấy bị bắt_nạt thì ra nói một câu bảo_vệ người ta , có_khi tối về lại có người nằm ôm . cứ cầm điện_thoại pin với chả không pin"
3925,748,Sadness,yêu sắp 2 năm rồi mà không biết người_yêu kể chuyện cho nghe là gì  đòi mấy lần toàn kêu không bình_thường xịu xịu
3926,1906,Enjoyment,hi_vọng câu_chuyện admin vừa bịa ra giúp các bạn có thêm niềm tin trong cuộc_sống  .
3927,1427,Sadness,nhiều lúc buồn đến_nỗi coi những vid thế_này . đéo thể cười nỗi .
3928,339,Fear,"đồng_nghiệp tốt , chị_em tốt đi làm như đi chơi : ) ) chứ làm cùng với mấy con mlz đáng sợ lắm : ) )"
3929,1649,Surprise,đây là cách các chàng trai thu_hút sự chú_ý của các cô gái hả ?
3930,898,Disgust,chủ vô_tâm có chó mà nuôi vất năn vất lóc không tắm_rửa để bẩn thì trả có giận có ve
3931,1434,Disgust,tránh xa tao ra
3932,966,Other,"đừng bao_giờ sợ trở_thành chính mình , bạn hãy nhớ bản_gốc luôn có giá_trị hơn bản_sao"
3933,852,Other,"và cô gái ăn cái bánh vài năm vẫn chưa xong ,"
3934,1671,Disgust,họp lớp cấp 2 đi được 2 lần . cấp 3 năm trước năm nay thôi nhưng đéo 
3935,1142,Enjoyment,yêu thế nhè  có em_gái chắc cũng vui lắm
3936,338,Enjoyment,viết tên anh trên cát cho sóng đập nát cái matlon anh : ) )
3937,432,Disgust,cái lò tao ghét nhất
3938,512,Other,per mày mà bị như thế_này chắc mày phải nhảy ra ngoài vũ_trụ luôn nhỉ
3939,48,Enjoyment,các b học_sinh đáng yêu quá
3940,1708,Anger,con_người chứ có phải con cặc đâu mà để nói hoài
3941,911,Other,"tuổi_thơ mình toàn đi đánh nhau với bọn con trai , có thằng ắt ơ nào chịu nhường_nhịn con gái đâu"
3942,1873,Surprise,"ủa tao tưởng trái bòn_bon chứ ,"
3943,752,Sadness,vì tiền mà làm đau làm khổ người khác như thế_này sao 
3944,123,Enjoyment,sao giống phim good doctor của hàn vậy ? ? cũng bệnh tự kỉ và có khả_năng nhìn được 3d !
3945,1500,Disgust,kệ cha nó
3946,352,Other,ngày_xưa tao cũng viết nhưng bị chị_gái đọc trộm từ đó dẹp mẹ nhật_ký luôn
3947,1472,Enjoyment,mai xem_lại phim nay . phim rất hay .
3948,1213,Anger,lm ngày có trăm_ngàn thôi mà dọn lòi lol vãi vả cức haizx thật
3949,52,Enjoyment,ông này đẹp vãi
3950,1584,Enjoyment,tuổi_trẻ tài cao : ) )
3951,832,Other,"chỉ cần đó là việc mình thích , không làm_phiền ai là được"
3952,982,Disgust,"mình thấy cũng bình_thường 樂 ny mình ủ hũ mắm_tôm , mắm_tép nếu tiếp_tục không rửa chắc hơn 30 năm nữa là đạt kỉ_lục thế_giới “ ủ mắm_tôm ” 60 năm mất 臘‍♂️"
3953,1322,Sadness,"em ơi , hết rồi  hết rồi , chẳng còn chi nữa đâu em ..."
3954,741,Disgust,có ai thấy tởm nhưng vẫn coi hết video như tao không 
3955,1476,Disgust,đúng chất trẻ trâu
3956,1368,Disgust,nó lợi_dụng ở 1 khía_cạnh nào đó mà thôi
3957,1099,Enjoyment,cuối_cùng là hai mình ăn được ngủ được : ) ) ) đứa nào cũng lên vài kí
3958,1447,Sadness,cả người_nhà người_yêu cũng không đồng_ý : ( (
3959,55,Fear,tao xem mà cứ sợ nó ngã vãi 
3960,1169,Sadness,"crush một ai đó là điều không bao_giờ có rồi , vì mình vừa béo , vừa xấu gái , vừa vv and vv . auto nhục "
3961,489,Other,per bố ơi bảo con rể làm thế đii : >
3962,892,Sadness,hôm_nay thật tệ : ( (
3963,1349,Disgust,chết mẹ mày đi ; ) ) ) không làm được thì nghỉ nhé . kiếm đồng_tiền của bố dễ à kkkk
3964,1875,Surprise,ông này tài quá
3965,1608,Surprise,per . ủa sao giống răng anh vậy
3966,660,Disgust,7 thằng này không phải con_người chúng_mày ạ
3967,1144,Disgust,kinh_tởm
3968,1053,Enjoyment,tag vô cho xem mấy đứa xấu tánh thôi chứ ghệ anh tánh cực_kỳ dt
3969,68,Fear,per nguy_hiểm vãi
3970,1483,Enjoyment,tao thích bài này lắm luôn ý
3971,1194,Sadness,"chấp_nhận đau_khổ , để đổi lấy hạnh_phúc , mà tìm mãi hạnh_phúc không đến thế mới đau em ."
3972,840,Disgust,tuổi_thơ của tao toàn chơi với lũ cướp đồ_ăn của tao với trêu tao cả ngày thôi chứ làm gì gặp được mấy soái như_vậy đâu .
3973,288,Other,mai anh gọi tôi dậy đi : ) )
3974,1438,Enjoyment,per vậy cug nghĩ ra được haha
3975,1045,Enjoyment,đố ai định_nghĩa được tình_yêu . có khó gì đâu một buổi chiều . nó chiếm hồn ta bằng nắng hạ . bằng mây nhè_nhẹ gío hiu_hiu 
3976,1947,Disgust,nhiệt_tình + ngu_dốt = phá_hoại . toàn óc đi xem bđ
3977,1819,Enjoyment,"ông sống trên vũ_trụ , vợ ông sống ở trái_đất , ông cao thêm 5cm là chuyện bthg "
3978,539,Other,"đồng_chí thịt vợ tương_lai của em thì nhẹ nhẹ đấy , không là phải cứ giã như gạo là không được đâu "
3979,1131,Disgust,nhạc hay chứ lời xàm .. vậy cũng rần_rần
3980,1668,Other,khóc_lóc rồi năm sau họp lớp đéo ai đi : ) )
3981,1489,Anger,"per mất dậy vãi , lớn lên nó sẽ biết nó làm như này trên tv là không hay"
3982,819,Other,ta và nàng cùng quên .
3983,1153,Sadness,em không muốn chúng_ta già đi chút nào . điều đó đồng_nghĩa với việc cta sắp xa nhau  # n
3984,1179,Disgust,"cấp tao tao toàn gặp mấy thằng trời_đánh , per với per , hai đứa mày có đọc được thì nhớ là tao vẫn ghim hai đứa mày vì hay trêu tao , còn một thằng tên per nữa , dume bị nó bắt_nạt cho khóc suốt "
3985,1317,Enjoyment,vỉa_hè to thế vẫn còn muốn ăn cả ồ hố nữa hả = ) )
3986,496,Other,đến đoạn chúng_nó ctay con_mẹ nó luôn : ) )
3987,832,Enjoyment,nhớ thời sinh_viên 
3988,1029,Other,"vui thôi đừng vui quá , làm ai cũng ngại"
3989,1432,Anger,đéo biết ! vợ tôi đéo cho nữa !
3990,127,Other,lạng_sơn đang nắng mà
3991,69,Fear,"thiện tai , thế_giới này khi nào mới được yên_bình"
3992,1298,Enjoyment,mới tết xong . tặng cặp bánh_chưng là ưng nhất : ) )
3993,1106,Sadness,giờ thì chả dám nhìn nữa hic : ( (
3994,1703,Disgust,tào_lao ròi đoá
3995,1652,Enjoyment,đến câu nào có đáp_số quen thì khoanh : ) )
3996,1078,Other,lở có sự_cố vì đó so với kỷ_luật vây có bằng_không
3997,909,Disgust,"nta nói đừng có nhìn mặt mà bắt hình_dong nhg mà thực_sự nhìn bả , tôi thấy cứ đanh_đá , mưu_mô , xảo_quyệt kiểu gì ý , cảm_thấy đây là con_người không có_hậu"
3998,272,Anger,đỉ lol đè chết mẹ đi . hát cái lol
3999,1699,Anger,công tình_yêu làm_ăn kiểu lồn gì vậy .
4000,685,Other,tưởng thế_nào 藍
4001,81,Enjoyment,vcb thu phí dịch_vụ cao có khác . lương nv cũng hơn chỗ khác : ) )
4002,1932,Surprise,đoạn 3 móc cái dt nhanh vliz
4003,317,Disgust,thì đã sao ? miếng cơm nghề_nghiệp người ta . nếu_như không thích quay thì lên đòi ban tổ_chức ấy hoặc đừng có mà chơi bóng chứ đâu ra cái kiểu bố đời ấy
4004,108,Fear,nguy_hiểm thật ... suýt_nữa tao ảo_tưởng con_mẹ nó luôn rồi ..
4005,362,Anger,"bố đã làm gì mày đâu , con chó này = ) )"
4006,1473,Sadness,"cùng cười cùng khóc cùng vượt qua khó_khăn , đau_khổ nhưng cuối_cùng lại là con_số 0 : )"
4007,661,Other,điều quan_trọng ở đây là mày cần sạc điện_thoại kìa
4008,1112,Enjoyment,t không phải con sến súa . ko cần quá cầu_kì lãng_mạn . cầu_hôn tao thế_này là tao đổ rồi per
4009,400,Other,giết người quá rồi giờ phải đi tù chứ : ) ) )
4010,1540,Enjoyment,con mèo đág yêuc quá 藍
4011,225,Disgust,bị đánh_bại bằng đòn mông . nổi ô_nhục đến chết cũng không hết_nổi
4012,724,Disgust,quả dạ vâng kia ngọt vãi ngọt . đéo bù khách của tao toàn được
4013,921,Other,tôi nói với các ông nhé . dắt bộ qua chốt cũng chưa chắc ngon_ăn per
4014,168,Enjoyment,đúng các anh 2 nghĩ ra nhiều kiểu quá
4015,883,Disgust,đã hói lại còn mắt thâm
4016,563,Sadness,thế nên tao với mày không_thể làm người_yêu nhau được
4017,1536,Sadness,mèo người ta đi lạc về nó còn nhớ chủ chủ còn được đụng nó còn mèo nhà tao đi tán trai có mấy tháng về nhà thấy chủ như thấy ma 
4018,1331,Sadness,ngày_xưa cũng như này trong lúc mối quan_hệ bắt_đầu nhạt : ) haiz
4019,1413,Enjoyment,"per đây là thằng con trai vừa đẹp còn có não , mong per học_hỏi ! xin cảm_ơn"
4020,806,Enjoyment,"ngày_xưa , ngoài thú_vui chọc chó dí , còn chọc cho ngỗg rượt . cách giảm cân hịu quả nhất cho mấy đứa lười  . nhớ lại vui thật , đúg là thời sửu nhi ."
4021,967,Sadness,mình toàn làm ba_mẹ buồn
4022,1094,Enjoyment,thèm được bố chửi 1 lần 襤襤
4023,13,Anger,thằng quay đáng bị đạp cho lăn con cụ ra mới biết sợ = ) ) cứ tưởng thế_là vui  súc_vật
4024,1350,Disgust,nuôi gì mà không có tâm gì v nè
4025,26,Other,tốt nhất không đi đâu cả nhé ..
4026,718,Other,bé giỏi toán quá nên cô_giáo mất_dạy luôn
4027,1088,Enjoyment,couple cuối . yêu chết đi được
4028,480,Other,cai nay do co roi . ai con ban nua không
4029,943,Sadness,đây là 1 câu_chuyện buồn
4030,265,Enjoyment,đã từng được ăn ké vài bữa 
4031,353,Enjoyment,cưng nhỉ
4032,189,Fear,"per này , thích thì xem cho đã con mắt đi  đáng sợ quá mà"
4033,639,Enjoyment,cũng thơm mà . kì_thị quá à .
4034,1270,Enjoyment,nếu ai cũng có ý_thức tốt_đẹp thì đất_nước này còn gì để nói . đâu có ai hoàn_toàn hoàn_hảo đâu bạn . dù là moi tần lớp
4035,812,Sadness,"thương quá . giờ con đi học ở lại cả ngày thì hên xui thôi chứ biết làm_sao , không ăn thịt heo thì ăn gì . mong sao có lệnh tạm dừng ăn thịt heo trong thời_gian này cho các trường mầm_non thì hay biết_mấy ."
4036,1269,Enjoyment,nhìn qua ảnh thôi cũng thích = ) )
4037,1372,Disgust,nhà thì như cái chuồng lợn còn bày_đặt đắp mặt !
4038,993,Sadness,"tôi xin nhắc lại , đây là một câu_chuyện buồn"
4039,697,Other,nên công_bố để răn_đe
4040,479,Sadness,"dù thế_nào thì anh tôi luôn bất_hạnh , ai khóc cho anh khấc tôi đây "
4041,14,Disgust,"đang làm nhiệm_vụ mà cứ léo_nhéo thế nhỉ , để cho cán_bộ gọi về cho chỉ_huy đi"
4042,810,Sadness,nấu cơm như_vậy xong đi lên nhà xem hoạt_hình .. đến lúc hết phim xuống để xới cơm thì .... khét_lẹt
4043,622,Enjoyment,có ai không sợ nhưng giật_mình như tao không : ) dumehuhonchimen
4044,312,Enjoyment,"đêm hôm coi lại , cười mún rụg rún"
4045,900,Sadness,năm nào mà tao chã cô_đơn
4046,405,Other,giận ngược trở_lại chúng_nó sớm chia_tay thôi : ) ) )
4047,1648,Surprise,sao trận này ông này khóc nhỉ : ) )
4048,1816,Disgust,bọn yêu nhau tưởng thế_là hay
4049,694,Disgust,"khi bạn cố_gắng kéo_lại với người ta và họ chụp màn_hình gửi cho mọi người , còn đem đi kể nữa chứ"
4050,315,Other,"bằng_lòng với những gì mình đang có đi , trên thế_giới có rất nhiều người không được như mình đâu"
4051,1820,Surprise,per bá_đạo quá 
4052,1065,Sadness,lâu rồi không được nhìn nụ cười ấy
4053,1321,Other,bao năm ăn_học ở trg mà các vị làm vài vụ như_thế_nào 1 năm thì lại vui quá . vks ạ
4054,1612,Enjoyment,dịch_vụ tận_tâm . đáng yêu quá ! : x
4055,1634,Enjoyment,câu_chuyện dễ_thương thật ^ ^
4056,1924,Enjoyment,là đi phát tờ_rơi ngay mấy ngã tư và cổng trường đại_học ! được 200k về mua skin yasuo siêu phẩm 2016
4057,485,Other,mình chỉ nói đến cơ_hội việc_làm thôi chứ không bàn_luận gì về việc ông ấy là người như_thế_nào bạn nhé ? ?
4058,274,Other,còn nhiều người khổ hơn mình : ) )
4059,1012,Sadness,"tội mày quá , lần sau mày bình_tĩnh hơn nhé"
4060,1852,Enjoyment,per cười đau bụng luôn 藍藍
4061,567,Anger,per dẹp hết . không có bán mua quần què gì nữa hết
4062,1160,Enjoyment,"nhìn 1 cái , cười 1 cái rồi về thôi"
4063,323,Enjoyment,tuổi_thơ dữ_dội là đây .
4064,1746,Enjoyment,tính ra con_bé đó chuyên_nghiệp ấy chứ
4065,605,Anger,cái địt con_mẹ mày ... biết bố mày xem xong tí rơi điện_thoại không 
4066,1269,Sadness,per sao tội vạy em
4067,400,Other,đéo hiểu
4068,403,Other,nhớ cái bếp của mẹ .
4069,944,Disgust,tao ghét nhất đăng mấy thể_loại v . đúg là nhãm lol
4070,1032,Disgust,ghét mấy cái thể_loại này . toàn lũ hãm
4071,697,Other,hẳn là phạt 5 triệu luôn
4072,721,Other,cuộc_sống mà
4073,304,Other,sao không mua thịt về ướp dưới nền rồi nướng luôn
4074,1623,Disgust,( ( = nói cái này quá là bình_thường luôn không đến mức phải xù lông nói là cười nhạo đâu ạ
4075,1515,Sadness,coi xong đoan này . tao thấy nhớ nhà vô_cùng 
4076,1241,Enjoyment,công_nhận  đồng_nghiệp hạp hạp tí có_khi ngồi buôn cả ngày bám hơn cả bám người_yêu . đi làm hôm nào cảm_thấy hôm đó ý_nghĩa vãi
4077,866,Other,ông_bà có đam_mê .
4078,646,Other,nếu_như bạn nào không biết là bạn đồ chanh chẹ
4079,799,Other,cái vị mà tao nghĩ đến cuối đời con_người vẫn chưa nếm hết
4080,1383,Enjoyment,hoá nhện tỏ_tình đấy : ) ) ) )
4081,1211,Sadness,tôi từng trách bố_mẹ sao sinh tôi ra trong hoàn_cảnh này
4082,1860,Surprise,khu này đẹp vãi chưởng
4083,469,Other,nhớ lại mỗi lần thay tim .. 
4084,1629,Surprise,em này sao giống chị tao quá vậy
4085,946,Other,"ngay bây_giờ , chỉ cần anh thật lòng với tôi là được : )"
4086,577,Other,per 2 đại_cao_thủ đấu đầu : ) )
4087,468,Enjoyment,dễ_thương vầy : >
4088,258,Other,tao đang nghiêm_túc đấy
4089,1220,Enjoyment,nói không phải khoe chứ em đi xe_bò đi học
4090,31,Anger,đm phải tao tao chửi mả bố nhà chúng_nó lên chứ trêu trêu cái lol  vả cho mỗi thằng ml vài cái chứ ở đấy cho chúng_nó quây rồi nhăn nhỉ với nhau ..
4091,894,Other,"hết cấp 3 , hết đại_học và chỉ mới bắt_đầu 1 cuộc_chơi khác ."
4092,941,Sadness,"cả đống người trên đường , mà nó chỉ dí mình tao  . t đã làm_nên tội gì "
4093,1081,Other,đã bảo cho tôi đi trước rồi mà không chịu . : v
4094,558,Other,per còn nhớ hay đã quên
4095,1120,Sadness,nếu chịu_khó đặt vào hoàn_cảnh của nhau mà sống thì cuộc_sống đơn_giản hơn rồi đó
4096,1084,Enjoyment,cưng v trờiiiiii .
4097,1182,Sadness,per  miss you .. chính_xác luôn ak hậu
4098,626,Other,rồi liệu nằm với vợ ông làm thế_nào nhỉ
4099,1370,Sadness,sau mỗi cuộc chia_ly người ở lại vẫn là người đau_lòng nhất : ( (
4100,1377,Enjoyment,"phim hay dã_man diễn_viên chính đẹp_trai , xem đi xem_lại không chán"
4101,1292,Sadness,tình_yêu là sự mù_quáng mà hix
4102,910,Enjoyment,dễ_thương quá
4103,1609,Enjoyment,"má , mặt đúng ngáo luôn "
4104,1486,Sadness,có một sự tổn_thương không hề nhẹ ở đây
4105,1238,Disgust,tết trung_thu chứ có phải tết “ giao_phối ” đâu mà cần gấu với chả gà 
4106,1268,Enjoyment,"per làm ở đâu không quan_trọng , quan_trọng là vẫn buôn chuyện đều "
4107,1155,Disgust,"kệ mẹ nó , giận được bao_nhiêu thì giận . cắm_sừng thì tao tiễn vong luôn"
4108,407,Anger,ra cái chỗ sóng không táp thì đéo ra cáu vãi : ) )
4109,1427,Enjoyment,hãy cảm_ơn vì chúa đã ban em cho chị 
4110,451,Sadness,họ đáp vì phép lịch_sự còn mình vì yêu mà chủ_động vì quan_tâm mà hỏi đủ điều .. 
4111,1641,Enjoyment,: ) ) bật nhạc lên và quẩy thôi
4112,1397,Enjoyment,nhà tôi còn nè
4113,1137,Enjoyment,per theo vợ nghĩ nếu là chồng thì chắc con đó dù là giả cũng sẽ lên nồi
4114,1805,Enjoyment,món này ngon vãi
4115,1026,Sadness,per viêm màn túi cấp nghiêm_trọng
4116,1090,Disgust,kinh vãi
4117,606,Other,đến bao_giờ mới nhận được tiền nhỉ
4118,1302,Enjoyment,dăm_ba con nhện nghĩ tao sợ ( ( ( =
4119,1406,Sadness,ngày buồn hôm ấy tôi cũng là người rời khỏi lớp cuối_cùng . ! ! !
4120,190,Disgust,"mình muốn tag mấy ông hàng_xóm vào đây để các bác ấy biết rằng , bác ấy không_chỉ buồn mà_còn hát rất dở"
4121,1548,Enjoyment,là mỗi buổi sáng thức dậy ta có thêm 1 ngày mới để yêu_thương ❤️ .
4122,402,Enjoyment,dume dễ_thương vãi ? ?
4123,1878,Anger,ủa làm gì đánh tao muốn chết vậy đuỹ ?
4124,394,Other,sau_này nhất_định phải nói_chuyện lịch_sự : ) ) ) ) không phải một người đọc mà là mọi người cùng đọc = ) ) ) )
4125,950,Enjoyment,"3s để tôi nói tôi yêu em và cả quãng đời còn lại để tôi chứng_minh lời tôi nói : "" tôi yêu em """
4126,1159,Enjoyment,ấm hơn cả người_yêu : ) )
4127,888,Enjoyment,e lên mang câu_chuyện này đi thi thách_thức danh_hài . rất duyên
4128,1314,Enjoyment,thấy topic đúng tâm_trạng quá .
4129,51,Other,chụp không biết_bao_nhiêu lần rồi
4130,1476,Enjoyment,bài này hay tuyệt_vời đấy ❤️
4131,753,Other,thật_ra là nó muốn kiếm em_gái anh_trai mưa đấy
4132,1260,Sadness,"ai mang đồ_ăn cho anh ấy đi , kẻo đói tội_nghiệp"
4133,1500,Sadness,"coi khúc đầu không hiểu , đến lúc ổng bước ra khỏi làn khói , thật không_thể cầm được nước_mắt"
4134,440,Other,rất biết cách ngồi đấy nhỉ ? ? ? ?
4135,434,Other,per phim đó thì nam chính hay nữ chính đều chạy cả
4136,174,Fear,mấy con yêu nghiệt ngày_xưa nội có nuôi 2 con cứ ra đằng sau là nó dí chạy muốn tuột mẹ quần 
4137,613,Other,"hồi xưa , giờ yêu kiểu người_lớn cơ_mà"
4138,331,Enjoyment,có vợ nên lắm . váy mới ngày trước toàn áo chấm bi của mẹ 藍藍
4139,987,Enjoyment,nó cưng quá mày
4140,1883,Surprise,trời có bạn nhận ra mình luôn à @ @
4141,1553,Sadness,
4142,206,Fear,tao nhìn sợ vãi
4143,499,Enjoyment,cảm_ơn bạn đã yêu đất_nước việt_nam tôi
4144,737,Other,quan_trọng là ông_bà nội_ngoại bạn phải giàu cái đã
4145,1730,Enjoyment,"chắc ông chồng hạnh_phúc lắm khi sống chung với người vợ như_vậy , những đứa con chắc cũng yêu mẹ họ lắm ! mà thặc ra là giống với mẹ tớ lắm kkk"
4146,1339,Sadness,ewww mình chẳng giữ được gì huhu
4147,1799,Surprise,vậy cũng được luôn hả ? 
4148,921,Enjoyment,"bộ phim này xem rất sướng . và rút ra được khám_phá là thứ tuyệt_vời nhất chứ không phải bằng_cấp . giá_như mấy ông "" bộ "" và mấy ông "" ngành "" dành thời_gian xem phim này một lần ."
4149,520,Sadness,xem không dưới 3 lần chia_sẻ không dưới 2 lần nhưng mỗi lần nhìn thấy lại xem_lại buồn
4150,265,Disgust,bây_giờ gái nó chỉ cần bông hoa_đồng_tiền ném vào mặt nó để nó ăn_tiêu chứ nó cần gì cái cây lu miên này .
4151,1250,Disgust,"mút này mình xịt nước cho nó mềm ra , lấy chổi đùa đùa lại quét tới lúc nghỉ_việc luôn quét cũng chưa xong nha , thứ nl"
4152,1186,Sadness,và hơn hết là tụi nó không còn coi mình là con gái nữa
4153,480,Anger,moẹ thấy u_ám hơn thì có . dume 
4154,193,Fear,hú_hồn lon vẫn còn
4155,452,Sadness,"một lúc_nào đó chúng_ta sẽ không nói_chuyện nữa , lúc đó có_lẽ em thật_sự đã buông bỏ được rồi ..."
4156,665,Disgust,hẳn là thần_tài . mê_tín vãi
4157,1744,Disgust,bớt chọc điên tao và bớt leo lên đầu tao ngồi  hãy để yên cho tao hiền 
4158,1161,Enjoyment,per kỷ_niệm khó quên nhỉ kkk
4159,1421,Disgust,địt_mẹ hoang_đường !
4160,1535,Disgust,"cô_giáo chủ_nhiệm hơi bị khốn nhỉ ? cô như_vậy thì học_sinh sao này học theo cái tính tráo_trở , hai mặt"
4161,1016,Other,xin chúa thương_xót chúng con
4162,798,Sadness,lâu quá mới nghe lại bài này buồn thế
4163,345,Enjoyment,rất thuyết_phục
4164,277,Other,mình hỏi mua rồi mà người ta kiểu nữa muốn bán nữa không bạn
4165,714,Sadness,buồn nhất_là crush cũng chả có để mà thả 
4166,1793,Surprise,"ồ ! thật là bất_ngờ , thật là thú zị , thật là liên_quan ?"
4167,209,Enjoyment,per anh tải cái này về cho per học nè . thú_vị ghê
4168,375,Enjoyment,per làm gì quên được kkkkk
4169,933,Other,nhìn thế thôi nhưng làm được video như này cũng khó lắm hay phết 
4170,124,Disgust,hợp lớp cái đéo gì được chục thằng = )
4171,1243,Disgust,ủa vậy phạm_tội thì có ẩn_danh không ? : ) ) ngộ àh
4172,704,Enjoyment,lấy vợ xong anh có_vẻ mũm_mĩm nhỉ : 333
4173,749,Enjoyment,dỗ lại dễ thôi mà . nhỉ nhỉ 藍藍藍
4174,1516,Anger,cho tao hỏi mấy con súc_vật tụi bây cười cái gì dzậy ? chắc tụi mày phải bị_gậy vụt vào mõm thì mới hết dám ngẩng mặt nhìn đời phải không ?
4175,448,Other,bạn nào cần bạn thân là con trai không : ) )
4176,1590,Sadness,tao bị quỳ cột cờ mới ác . cả trường biết mặt luôn . nhục vãi
4177,545,Enjoyment,tao đã đóng_dấu cấm đứa nào rớ vào = ) ) ) )
4178,488,Anger,"dm tuổi_thơ tao lại toàn ba thằng hãm lol , độc chép bài .... đùa đùa đéo cho chép chúng_nó chửi sấp_mặt luôn ☹️"
4179,1222,Anger,và thế đéo nào chúng_nó toàn gọi mình là thằng 
4180,1006,Disgust,khôn lõi_đời à ? chừa này
4181,195,Other,cũng chỉ là tạm_thời . chỉ khi nào nguồn nước bẩn thôi đổ vào sông thì mới đảm_bảo được .
4182,428,Enjoyment,per ru con để vợ đắp mặt_nạ kìa ? ? đúng là chồng người ta chưa bao_giờ làm mình thất_vọng ? ?
4183,863,Other,"thật_thà vãi , mà tao chỉ thích ăn xoài chua ."
4184,473,Other,per vẩy cật_lực luôn = ) )
4185,1083,Disgust,sao toàn gái ngành với bọn chủ_tịch bình_luận không vậy 
4186,729,Other,đây còn hơn cả vua . giàu mà nghĩ lớn làm lớn .
4187,1921,Surprise,bất_ngờ thiệt : ) ) ) )
